[
  {
    "passport_iso": "BRA",
    "destination_iso": "GBR",
    "visa_required": false,
    "visa_type": "visa-free",
    "processing_days_min": 0,
    "processing_days_max": 0,
    "official_url": "https://www.gov.uk/check-uk-visa",
    "fee_usd_estimate": 0,
    "notes": "Visa-free short-stay travel. Verify entry rules before departure.",
    "last_verified": "2026-05-23"
  },
  {
    "passport_iso": "BRA",
    "destination_iso": "JPN",
    "visa_required": false,
    "visa_type": "visa-free",
    "processing_days_min": 0,
    "processing_days_max": 0,
    "official_url": "https://www.mofa.go.jp/j_info/visit/visa/index.html",
    "fee_usd_estimate": 0,
    "notes": "Visa-free short-stay travel. Verify entry rules before departure.",
    "last_verified": "2026-05-23"
  },
  {
    "passport_iso": "BRA",
    "destination_iso": "SCH",
    "visa_required": true,
    "visa_type": "evisa-or-consulate",
    "processing_days_min": 7,
    "processing_days_max": 21,
    "official_url": "https://home-affairs.ec.europa.eu/policies/schengen-borders-and-visa/visa-policy_en",
    "fee_usd_estimate": 80,
    "notes": "Tourist visa or electronic travel authorization may be required. Verify with the official government source before booking.",
    "last_verified": "2026-05-23"
  },
  {
    "passport_iso": "BRA",
    "destination_iso": "USA",
    "visa_required": true,
    "visa_type": "evisa-or-consulate",
    "processing_days_min": 7,
    "processing_days_max": 21,
    "official_url": "https://travel.state.gov/content/travel/en/us-visas.html",
    "fee_usd_estimate": 80,
    "notes": "Tourist visa or electronic travel authorization may be required. Verify with the official government source before booking.",
    "last_verified": "2026-05-23"
  },
  {
    "passport_iso": "EGY",
    "destination_iso": "GBR",
    "visa_required": true,
    "visa_type": "evisa-or-consulate",
    "processing_days_min": 7,
    "processing_days_max": 21,
    "official_url": "https://www.gov.uk/check-uk-visa",
    "fee_usd_estimate": 80,
    "notes": "Tourist visa or electronic travel authorization may be required. Verify with the official government source before booking.",
    "last_verified": "2026-05-23"
  },
  {
    "passport_iso": "EGY",
    "destination_iso": "JPN",
    "visa_required": true,
    "visa_type": "consulate-visa",
    "processing_days_min": 5,
    "processing_days_max": 14,
    "official_url": "https://www.mofa.go.jp/j_info/visit/visa/index.html",
    "fee_usd_estimate": 25,
    "notes": "Tourist visa or electronic travel authorization may be required. Verify with the official government source before booking.",
    "last_verified": "2026-05-23"
  },
  {
    "passport_iso": "EGY",
    "destination_iso": "USA",
    "visa_required": true,
    "visa_type": "evisa-or-consulate",
    "processing_days_min": 7,
    "processing_days_max": 21,
    "official_url": "https://travel.state.gov/content/travel/en/us-visas.html",
    "fee_usd_estimate": 80,
    "notes": "Tourist visa or electronic travel authorization may be required. Verify with the official government source before booking.",
    "last_verified": "2026-05-23"
  },
  {
    "passport_iso": "GBR",
    "destination_iso": "AUS",
    "visa_required": true,
    "visa_type": "evisa-or-consulate",
    "processing_days_min": 7,
    "processing_days_max": 21,
    "official_url": "https://immi.homeaffairs.gov.au/visas/getting-a-visa/visa-finder",
    "fee_usd_estimate": 80,
    "notes": "Tourist visa or electronic travel authorization may be required. Verify with the official government source before booking.",
    "last_verified": "2026-05-23"
  },
  {
    "passport_iso": "GBR",
    "destination_iso": "JPN",
    "visa_required": false,
    "visa_type": "visa-free",
    "processing_days_min": 0,
    "processing_days_max": 0,
    "official_url": "https://www.mofa.go.jp/j_info/visit/visa/index.html",
    "fee_usd_estimate": 0,
    "notes": "Visa-free short-stay travel. Verify entry rules before departure.",
    "last_verified": "2026-05-23"
  },
  {
    "passport_iso": "GBR",
    "destination_iso": "SCH",
    "visa_required": false,
    "visa_type": "visa-free",
    "processing_days_min": 0,
    "processing_days_max": 0,
    "official_url": "https://home-affairs.ec.europa.eu/policies/schengen-borders-and-visa/visa-policy_en",
    "fee_usd_estimate": 0,
    "notes": "Visa-free short-stay travel. Verify entry rules before departure.",
    "last_verified": "2026-05-23"
  },
  {
    "passport_iso": "GBR",
    "destination_iso": "USA",
    "visa_required": true,
    "visa_type": "evisa-or-consulate",
    "processing_days_min": 7,
    "processing_days_max": 21,
    "official_url": "https://travel.state.gov/content/travel/en/us-visas.html",
    "fee_usd_estimate": 80,
    "notes": "Tourist visa or electronic travel authorization may be required. Verify with the official government source before booking.",
    "last_verified": "2026-05-23"
  },
  {
    "passport_iso": "IDN",
    "destination_iso": "AUS",
    "visa_required": true,
    "visa_type": "evisa-or-consulate",
    "processing_days_min": 7,
    "processing_days_max": 21,
    "official_url": "https://immi.homeaffairs.gov.au/visas/getting-a-visa/visa-finder",
    "fee_usd_estimate": 80,
    "notes": "Tourist visa or electronic travel authorization may be required. Verify with the official government source before booking.",
    "last_verified": "2026-05-23"
  },
  {
    "passport_iso": "IDN",
    "destination_iso": "GBR",
    "visa_required": true,
    "visa_type": "evisa-or-consulate",
    "processing_days_min": 7,
    "processing_days_max": 21,
    "official_url": "https://www.gov.uk/check-uk-visa",
    "fee_usd_estimate": 80,
    "notes": "Tourist visa or electronic travel authorization may be required. Verify with the official government source before booking.",
    "last_verified": "2026-05-23"
  },
  {
    "passport_iso": "IDN",
    "destination_iso": "JPN",
    "visa_required": true,
    "visa_type": "consulate-visa",
    "processing_days_min": 5,
    "processing_days_max": 14,
    "official_url": "https://www.mofa.go.jp/j_info/visit/visa/index.html",
    "fee_usd_estimate": 25,
    "notes": "Tourist visa or electronic travel authorization may be required. Verify with the official government source before booking.",
    "last_verified": "2026-05-23"
  },
  {
    "passport_iso": "IDN",
    "destination_iso": "SCH",
    "visa_required": true,
    "visa_type": "evisa-or-consulate",
    "processing_days_min": 7,
    "processing_days_max": 21,
    "official_url": "https://home-affairs.ec.europa.eu/policies/schengen-borders-and-visa/visa-policy_en",
    "fee_usd_estimate": 80,
    "notes": "Tourist visa or electronic travel authorization may be required. Verify with the official government source before booking.",
    "last_verified": "2026-05-23"
  },
  {
    "passport_iso": "IDN",
    "destination_iso": "SGP",
    "visa_required": false,
    "visa_type": "visa-free",
    "processing_days_min": 0,
    "processing_days_max": 0,
    "official_url": "https://www.ica.gov.sg/enter-transit-depart/entering-singapore/visa_requirements",
    "fee_usd_estimate": 0,
    "notes": "Visa-free short-stay travel. Verify entry rules before departure.",
    "last_verified": "2026-05-23"
  },
  {
    "passport_iso": "IDN",
    "destination_iso": "USA",
    "visa_required": true,
    "visa_type": "evisa-or-consulate",
    "processing_days_min": 7,
    "processing_days_max": 21,
    "official_url": "https://travel.state.gov/content/travel/en/us-visas.html",
    "fee_usd_estimate": 80,
    "notes": "Tourist visa or electronic travel authorization may be required. Verify with the official government source before booking.",
    "last_verified": "2026-05-23"
  },
  {
    "passport_iso": "IND",
    "destination_iso": "AUS",
    "visa_required": true,
    "visa_type": "evisa-or-consulate",
    "processing_days_min": 7,
    "processing_days_max": 21,
    "official_url": "https://immi.homeaffairs.gov.au/visas/getting-a-visa/visa-finder",
    "fee_usd_estimate": 80,
    "notes": "Tourist visa or electronic travel authorization may be required. Verify with the official government source before booking.",
    "last_verified": "2026-05-23"
  },
  {
    "passport_iso": "IND",
    "destination_iso": "GBR",
    "visa_required": true,
    "visa_type": "evisa-or-consulate",
    "processing_days_min": 7,
    "processing_days_max": 21,
    "official_url": "https://www.gov.uk/check-uk-visa",
    "fee_usd_estimate": 80,
    "notes": "Tourist visa or electronic travel authorization may be required. Verify with the official government source before booking.",
    "last_verified": "2026-05-23"
  },
  {
    "passport_iso": "IND",
    "destination_iso": "JPN",
    "visa_required": true,
    "visa_type": "consulate-visa",
    "processing_days_min": 5,
    "processing_days_max": 14,
    "official_url": "https://www.mofa.go.jp/j_info/visit/visa/index.html",
    "fee_usd_estimate": 25,
    "notes": "Tourist visa or electronic travel authorization may be required. Verify with the official government source before booking.",
    "last_verified": "2026-05-23"
  },
  {
    "passport_iso": "IND",
    "destination_iso": "SCH",
    "visa_required": true,
    "visa_type": "evisa-or-consulate",
    "processing_days_min": 7,
    "processing_days_max": 21,
    "official_url": "https://home-affairs.ec.europa.eu/policies/schengen-borders-and-visa/visa-policy_en",
    "fee_usd_estimate": 80,
    "notes": "Tourist visa or electronic travel authorization may be required. Verify with the official government source before booking.",
    "last_verified": "2026-05-23"
  },
  {
    "passport_iso": "IND",
    "destination_iso": "SGP",
    "visa_required": true,
    "visa_type": "consulate-visa",
    "processing_days_min": 7,
    "processing_days_max": 21,
    "official_url": "https://www.ica.gov.sg/enter-transit-depart/entering-singapore/visa_requirements",
    "fee_usd_estimate": 80,